{
  "schemaVersion": "1.1.0",
  "generatedAt": "2026-10-16T03:01:00Z",
  "counts": {
    "solutions": 23,
    "tier1": 6,
    "tier2": 9,
    "tier3": 8,
    "framework_controls_referenced": 56,
    "doc_files_total": 184
  },
  "solutions": [
    {
      "id": "01-copilot-readiness-scanner",
      "name": "Copilot Readiness Assessment Scanner",
      "tier": 1,
      "version": "0.2.4",
      "domain": "readiness-data",
      "controlCoverage": [
        "1.1",
        "1.5",
        "1.6",
        "1.7",
        "1.9"
      ],
      "docFileCount": 8,
      "tiersSupported": [
        "baseline",
        "recommended",
        "regulated"
      ],
      "tierRecommended": "regulated",
      "tierMaturity": "active",
      "maturity": "documentation-first-scaffold"
    },
    {
      "id": "02-oversharing-risk-assessment",
      "name": "Oversharing Risk Assessment and Remediation",
      "tier": 1,
      "version": "0.2.5",
      "domain": "readiness-data",
      "controlCoverage": [
        "1.2",
        "1.3",
        "1.4",
        "1.6",
        "2.12",
        "2.5"
      ],
      "docFileCount": 8,
      "tiersSupported": [
        "baseline",
        "recommended",
        "regulated"
      ],
      "tierRecommended": "regulated",
      "tierMaturity": "active",
      "maturity": "documentation-first-scaffold"
    },
    {
      "id": "03-sensitivity-label-auditor",
      "name": "Sensitivity Label Coverage Auditor",
      "tier": 2,
      "version": "0.2.4",
      "domain": "readiness-data",
      "controlCoverage": [
        "1.5",
        "2.2",
        "3.11",
        "3.12"
      ],
      "docFileCount": 8,
      "tiersSupported": [
        "baseline",
        "recommended",
        "regulated"
      ],
      "tierRecommended": "recommended",
      "tierMaturity": "active",
      "maturity": "documentation-first-scaffold"
    },
    {
      "id": "04-finra-supervision-workflow",
      "name": "FINRA Supervision Workflow for Copilot",
      "tier": 1,
      "version": "0.2.3",
      "domain": "security-compliance",
      "controlCoverage": [
        "3.4",
        "3.5",
        "3.6"
      ],
      "docFileCount": 8,
      "tiersSupported": [
        "baseline",
        "recommended",
        "regulated"
      ],
      "tierRecommended": "regulated",
      "tierMaturity": "active",
      "maturity": "documentation-first-scaffold"
    },
    {
      "id": "05-dlp-policy-governance",
      "name": "DLP Policy Governance for Copilot",
      "tier": 2,
      "version": "0.2.3",
      "domain": "security-compliance",
      "controlCoverage": [
        "2.1",
        "3.10",
        "3.12"
      ],
      "docFileCount": 8,
      "tiersSupported": [
        "baseline",
        "recommended",
        "regulated"
      ],
      "tierRecommended": "recommended",
      "tierMaturity": "active",
      "maturity": "documentation-first-scaffold"
    },
    {
      "id": "06-audit-trail-manager",
      "name": "Copilot Interaction Audit Trail Manager",
      "tier": 1,
      "version": "0.2.3",
      "domain": "security-compliance",
      "controlCoverage": [
        "3.1",
        "3.11",
        "3.12",
        "3.2",
        "3.3"
      ],
      "docFileCount": 8,
      "tiersSupported": [
        "baseline",
        "recommended",
        "regulated"
      ],
      "tierRecommended": "regulated",
      "tierMaturity": "active",
      "maturity": "documentation-first-scaffold"
    },
    {
      "id": "07-conditional-access-automation",
      "name": "Conditional Access Policy Automation for Copilot",
      "tier": 2,
      "version": "0.2.5",
      "domain": "security-compliance",
      "controlCoverage": [
        "2.3",
        "2.6",
        "2.9"
      ],
      "docFileCount": 8,
      "tiersSupported": [
        "baseline",
        "recommended",
        "regulated"
      ],
      "tierRecommended": "recommended",
      "tierMaturity": "active",
      "maturity": "documentation-first-scaffold"
    },
    {
      "id": "08-license-governance-roi",
      "name": "License Governance and ROI Tracker",
      "tier": 2,
      "version": "0.1.3",
      "domain": "operations-analytics",
      "controlCoverage": [
        "1.9",
        "4.5",
        "4.6",
        "4.8"
      ],
      "docFileCount": 8,
      "tiersSupported": [
        "baseline",
        "recommended",
        "regulated"
      ],
      "tierRecommended": "recommended",
      "tierMaturity": "active",
      "maturity": "documentation-first-scaffold"
    },
    {
      "id": "09-feature-management-controller",
      "name": "Copilot Feature Management Controller",
      "tier": 2,
      "version": "0.1.3",
      "domain": "operations-analytics",
      "controlCoverage": [
        "2.6",
        "4.1",
        "4.12",
        "4.13",
        "4.2",
        "4.3",
        "4.4"
      ],
      "docFileCount": 8,
      "tiersSupported": [
        "baseline",
        "recommended",
        "regulated"
      ],
      "tierRecommended": "recommended",
      "tierMaturity": "active",
      "maturity": "documentation-first-scaffold"
    },
    {
      "id": "10-connector-plugin-governance",
      "name": "Copilot Connector and Plugin Governance",
      "tier": 3,
      "version": "0.2.4",
      "domain": "operations-analytics",
      "controlCoverage": [
        "1.13",
        "2.13",
        "2.14",
        "2.16",
        "4.13"
      ],
      "docFileCount": 8,
      "tiersSupported": [
        "baseline",
        "recommended",
        "regulated"
      ],
      "tierRecommended": "recommended",
      "tierMaturity": "active",
      "maturity": "documentation-first-scaffold"
    },
    {
      "id": "11-risk-tiered-rollout",
      "name": "Risk-Tiered Rollout Automation",
      "tier": 1,
      "version": "0.1.3",
      "domain": "operations-analytics",
      "controlCoverage": [
        "1.11",
        "1.12",
        "1.9",
        "4.12"
      ],
      "docFileCount": 8,
      "tiersSupported": [
        "baseline",
        "recommended",
        "regulated"
      ],
      "tierRecommended": "regulated",
      "tierMaturity": "active",
      "maturity": "documentation-first-scaffold"
    },
    {
      "id": "12-regulatory-compliance-dashboard",
      "name": "Regulatory Compliance Dashboard",
      "tier": 1,
      "version": "0.1.3",
      "domain": "operations-analytics",
      "controlCoverage": [
        "3.12",
        "3.13",
        "3.7",
        "3.8",
        "4.5",
        "4.7"
      ],
      "docFileCount": 8,
      "tiersSupported": [
        "baseline",
        "recommended",
        "regulated"
      ],
      "tierRecommended": "regulated",
      "tierMaturity": "active",
      "maturity": "documentation-first-scaffold"
    },
    {
      "id": "13-dora-resilience-monitor",
      "name": "DORA Operational Resilience Monitor",
      "tier": 3,
      "version": "0.1.3",
      "domain": "regulatory-resilience",
      "controlCoverage": [
        "2.7",
        "4.10",
        "4.11",
        "4.9"
      ],
      "docFileCount": 8,
      "tiersSupported": [
        "baseline",
        "recommended",
        "regulated"
      ],
      "tierRecommended": "recommended",
      "tierMaturity": "active",
      "maturity": "documentation-first-scaffold"
    },
    {
      "id": "14-communication-compliance-config",
      "name": "Communication Compliance Configurator",
      "tier": 3,
      "version": "0.2.4",
      "domain": "regulatory-resilience",
      "controlCoverage": [
        "2.10",
        "3.4",
        "3.5",
        "3.6",
        "3.9"
      ],
      "docFileCount": 8,
      "tiersSupported": [
        "baseline",
        "recommended",
        "regulated"
      ],
      "tierRecommended": "recommended",
      "tierMaturity": "active",
      "maturity": "documentation-first-scaffold"
    },
    {
      "id": "15-pages-notebooks-gap-monitor",
      "name": "Copilot Pages and Notebooks Compliance Gap Monitor",
      "tier": 3,
      "version": "0.1.3",
      "domain": "regulatory-resilience",
      "controlCoverage": [
        "2.11",
        "3.11",
        "3.2",
        "3.3"
      ],
      "docFileCount": 8,
      "tiersSupported": [
        "baseline",
        "recommended",
        "regulated"
      ],
      "tierRecommended": "recommended",
      "tierMaturity": "active",
      "maturity": "documentation-first-scaffold"
    },
    {
      "id": "16-item-level-oversharing-scanner",
      "name": "Item-Level Oversharing Scanner",
      "tier": 2,
      "version": "0.1.3",
      "domain": "readiness-data",
      "controlCoverage": [
        "1.2",
        "1.3",
        "1.4",
        "1.6",
        "2.5"
      ],
      "docFileCount": 8,
      "tiersSupported": [
        "baseline",
        "recommended",
        "regulated"
      ],
      "tierRecommended": "recommended",
      "tierMaturity": "active",
      "maturity": "documentation-first-scaffold"
    },
    {
      "id": "17-sharepoint-permissions-drift",
      "name": "SharePoint Permissions Drift Detection",
      "tier": 2,
      "version": "0.1.4",
      "domain": "readiness-data",
      "controlCoverage": [
        "1.2",
        "1.4",
        "1.6",
        "2.5"
      ],
      "docFileCount": 8,
      "tiersSupported": [
        "baseline",
        "recommended",
        "regulated"
      ],
      "tierRecommended": "recommended",
      "tierMaturity": "active",
      "maturity": "documentation-first-scaffold"
    },
    {
      "id": "18-entra-access-reviews",
      "name": "Entra Access Reviews Automation",
      "tier": 2,
      "version": "0.1.5",
      "domain": "readiness-data",
      "controlCoverage": [
        "1.2",
        "1.6",
        "2.12",
        "2.5"
      ],
      "docFileCount": 8,
      "tiersSupported": [
        "baseline",
        "recommended",
        "regulated"
      ],
      "tierRecommended": "recommended",
      "tierMaturity": "active",
      "maturity": "documentation-first-scaffold"
    },
    {